Organization Name,Industries,CB Rank (Organization),Full Description
BYJU’S,"E-Learning, EdTech, Education",106,"BYJU’S is a global ed-tech company that provides highly adaptive, engaging, and effective learning solutions to more than 150 million students around the world. Founded in India in 2011, BYJU's mission is to make high-quality learning accessible to students everywhere. The BYJU's family of brands includes Disney-BYJU's Early Learn, BYJU's FutureSchool, Epic!, Osmo, Tynker, Toppr, and WhiteHat Jr., along with the company’s beloved flagship product, BYJU's: The Learning App. Together, BYJU's solutions support pre-K–12 education and a wide range of competitive exams. BYJU’S delivers a world-class learning experience with tools that sit at the crossroads of mobile, interactive content, and personalized learning methodologies. Byju's geography-agnostic solutions and 12,000+ teachers make learning engaging with visual and contextual programs that adapt to the unique learning style, skill level, and pace of each student. In addition, BYJU’S has innovative partnerships with some of the world's largest companies, including Disney and Google, to drive engagement and help even more students become active and lifelong learners. BYJU’S is backed by blue-chip investors including the Chan-Zuckerberg Initiative, Sequoia Capital, Bond Capital, Silver Lake, BlackRock, Sands Capital Management, Alkeon Capital Management, Sofina, Verlinvest, Tencent, Prosus (previously Naspers Ventures), CPPIB, General Atlantic, Tiger Global, Qatar Investment Authority, Owl Ventures, Lightspeed Venture Partners, Times Internet, Aarin Capital, and IFC. Since 2017, BYJU’S has completed more than 15 acquisitions, including companies in the U.S., UK, Austria, India, and Singapore.  A 2021 Time 100 Most Influential Company, BYJU’S is headquartered in India, with operations in more than 21 countries globally and learning programs in more than 8 languages."
SeedBlink,"Apps, Artificial Intelligence, Biotechnology, Cyber Security, EdTech, Financial Services, FinTech, Machine Learning, Property Management, Software",109,"Seedblink is Europe’s fastest growing investing platform specialized in sourcing, vetting, financing and scaling tech start-ups. We leverage software, capital and an exclusive industry community to lower barriers to accessing VC level opportunities for both investors and founders."
Coursera,"E-Learning, EdTech, Education, Internet",149,"Coursera is an online education company that serves over 20 million registered learners by partnering with 140 of the world’s universities and education institutions. On Coursera, anyone, anywhere can access over 1,000 online courses and Specializations in dozens of fields in order to achieve meaningful career, educational, and personal enrichment goals throughout their lives. The company was founded in 2012 and is headquartered in Mountain View, California."
Preply,"E-Learning, EdTech, Education, Language Learning, Tutoring",166,"Preply is on a mission to shape the future of effective learning. Fueled by the belief that live engagement with a teacher is still an effective way to learn a new skill, Preply is building a personalized learning space that will enable individual learners to reach their full potential. It is a global language learning marketplace, connecting 50,000+ tutors with millions of learners. Since the company launched in 2012, students have signed up for more than 15 million lessons. Preply is an online language tutoring segment and has 400+ employees of over 50 nationalities based across Barcelona, Kyiv, and the US. Preply is driven by a culture of experimentation and data-driven learning focused on building consumer and enterprise learning solutions."
GoStudent,"EdTech, Education, Tutoring",249,"GoStudent is a platform for online teaching and is the future of tutoring. Via its platform, GoStudent provides paid, one-to-one, video-based tuition to primary, secondary, and college-aged students in 20+ subjects, using a membership model. Lessons are booked via the GoStudent platform and accessed using a computer or a mobile device. During each tutoring session, students and tutors interact live in a virtual classroom. Integrated features, such as a whiteboard and the option to share a screen and edit documents together, are included.  GoStudent employs more than 600 people and has opened 12 international offices. Over 400,000 tutoring units are booked each month. Currently, GoStudent has around 15,000 customers and works with 5,500 international tutors. To date, GoStudent has raised more than €291m. Investors include Left Lane Capital, DN Capital, Coatue, and DST Global."
Hybe,"EdTech, Media and Entertainment, Music, Music Education",253,"HYBE is a music-based entertainment lifestyle platform company. It engages in Music Production, Publishing, New Artist Development, Artist Management, 360° Business, IP Business, and Platform Business."
Campus,"EdTech, Education, Higher Education",355,"Campus is a fully accredited online community college, powered by a network of professors who also teach at the universities. Campus provides online learning services."
Educbank,"EdTech, Education, Financial Services, FinTech",435,"Educbank is a financial ecosystem dedicated to K-12 schools, intended to expand access to quality education in Brazil, through services’ management and financial support to educational institutions by providing payment guaranty to school tuitions. This investment will enable Vasta to capture great value potential in the following years, by tapping the K-12 tuitions payment means, which total payment volume (TPV) surpasses R$70 billion per year. Educbank’s services complement Vasta’s digital services platform, which provides access to data, management tools and now working capital management, releasing time for school partners to focus on delivering education. Educbank was established on June 3, 2020 by Danilo Costa in Sao Paulo, Brazil."
Marwari Catalysts,"AgTech, B2C, Communities, EdTech, FinTech, Health Care, Home Decor, SaaS",455,"Marwari Catalysts primarily focuses on creating, nurturing, and fostering startups to accelerate their journey from a startup to a unicorn. We have a backward integration with incubators and front-end integration with the AIF, Family Offices and Angel Networks. Marwari Catalysts is a founder & investor-friendly company with like minded professionals and industry experts passionate about entrepreneurship. We conduct a Startup Acceleration program: 'Thrive'; India's most exhilarating and value-based cohort accelerator program for early-stage startups. Thrive is a 12-week rigorous program that enables a particular startup to accelerate and helps them become investment-ready by providing: a skillset, expertise, and guidance from mentors via the program. The most successful Startup Founders & Top Industry Leaders will accompany you as mentors; to pilot your startup success to reach the sky. It is the only accelerator program with Skin-in-the-game providing signal funding to all the chosen startups. We already have companies from sectors, such as D2C, B2B, Edu Tech, FinTech, Fashion, Lifestyle Products, Community Building, to name a few and are currently working on Supply Chain Management and Climate Change. Marwari Catalysts is India's fastest growing Startup Accelerator.  Our People: We are a closed knit group of successful startup founders, professionals and industrialists with strong professional and academic credentials. 100+ Co-founders Club, 60+ Startups Portfolio, 35% Female Founders, 70% Startups funded, $10Mn Portfolio Valuation, 7 Startups Exit (full and part)  Marwari Catalysts strongly supports the fact that their partnerships with startups are about discovery as well as execution and believes in value creation. An inclusive model which supports startups at various stages in their life-cycle, whether incubation, funding, acceleration, PR or business development support."
ExecOnline,"Corporate Training, E-Learning, EdTech, Education, Software, Training",649,"ExecOnline delivers transformational learning experiences to corporate leaders. Through partnerships with business schools such as Berkeley Haas, Chicago Booth, Columbia, Tuck at Dartmouth, Duke CE, IMD, Ivey, MIT-Sloan, Stanford GSB, Wharton, and Yale, the e-learning company provides leadership courses. As a Forbes “Technology Company to Watch,” its proprietary online ecosystem combines the engagement of on-campus study with the convenience of online education, through dynamic, high-impact experiences tailored to the unique strategic, innovation, and operation concerns of corporate executives. In 2012, Stephen Bailey, Mark Ozer, Barry Goldberg, and Julia Alexander co-founded the company in New York, New York."
Kahoot!,"E-Learning, EdTech, Education, Gamification, Gaming, Mobile, Software, Training",667,"Kahoot! is a game-based learning platform that makes it easy to create, share, and play fun learning games or trivia quizzes in minutes. The platform offers learning games in minutes for any subject, in any language, on any device, and for all ages. Based on the mission of making learning awesome, Kahoot!’s game-based platform engages the heart, hand, and mind, creating a wildly more social, meaningful, and powerful pedagogical experience. Kahoot!’s platform and easy-to-use features attract educators and students as well as corporate powerhouses, sporting, and cultural events. In 2012, co-founders Alf Inge Wang, Asmund Furuseth, Jamie Brooker, Johan Brand, and Morten Versvik established the company in Oslo, Oslo."
Wonderschool,"Child Care, EdTech, Education, Parenting, Primary Education",678,"Started in 2016 by a group of educators and technologists in California, Wonderschool offers a platform where people can start infant and toddler programs and preschools out of their homes. Wonderschool supports experienced educators and childcare providers to start their own childcares or preschools out of their homes, whether they live in apartments, condos, or homes that they rent or own. Wonderschool provides assistance with licensing, program setup, marketing and everything in between. The company’s software platform allows teachers to manage their students, parents, and their program from one dashboard. Along with this, Wonderschool has built a marketplace for parents to search Wonderschool programs, schedule visits, enroll their children, and make payments. It’s been proven time and time again that children should start developing cognitive, motor, behavioral, and social skills from as early as 6 months and Wonderschool is committed to increasing families’ access to high quality care and learning environments for children."
Leverage Edu,"Artificial Intelligence, Career Planning, EdTech, Education, Higher Education, Internet, Marketplace",696,"Leverage Edu is an AI-enabled marketplace designed to help students with their higher education and career growth plans. It is one of India's leading/fastest growing ed-tech companies, transforming access to an exponential career growth, by democratising mentorship, breaking traditional systems, & helping the new student of today jump over the artificial high walls!"
UpGrad,"E-Learning, EdTech, Education",776,"UpGrad is an online platform that offers educational services to its clients. UpGrad’s range of programs consists of digital marketing, product management, entrepreneurship, data analytics, data-driven management, and digital technology management. It offers industry insights and student support services. UpGrad was launched in 2015 by Phalgun Kompalli, Ronnie Screwvala, Ravijot Chugh, and Mayank Kumar and is based in Mumbai."
Nearpod,"E-Learning, EdTech, Education, Mobile Apps, Skill Assessment, Software, Virtual Reality",793,"Nearpod is an all-in-one solution for the synchronized use of iPads in the classroom that makes lectures more engaging through interactive multimedia presentations.  With Nearpod, teachers can create mobile presentations, engage students in class, and assess them in real time. The fast adoption of tablet computing and mobile devices is having a profound impact on education. Nearpod allows educators to very easily take their existing presentations, convert them into mobile-friendly content, and engage all students to convert them into active classroom participants. Teachers can deliver their existing content through mobile (iOS or Android) devices and get instant feedback from students through interactive features like polls, quizzes, drawing activities, and others."
LMS365,"Corporate Training, E-Learning, EdTech, Education, SaaS, Software, Training","1,020","LMS365 provides a complete LMS for Office 365 and SharePoint, making learning accessible, anytime, anywhere."
Village Capital,"Agriculture, EdTech, Education, Finance, Financial Services, FinTech","1,049","Village Capital uses the power of peer support to change the traditional dynamics between investors and entrepreneurs, providing access to entrepreneurship for everyone.  We recruit entrepreneurs solving specific problems in agriculture, energy, education, financial inclusion, and health. We then put the power of investment in the hands of the entrepreneurs, who award pre-committed seed funding to the two ventures ranked highest by the entrepreneurs at the end of every program. Our programs connect high potential, early-stage entrepreneurs with the people, institutions, and capital they need to succeed. We support early-stage ventures with a 501c3 nonprofit that operates training programs for founders, investors, and communities. We also manage a for-profit, managed investment fund that provides early-stage capital to top graduates of each program, as selected by their peers. Our unique peer-selection model received McKinsey/Harvard Business Review’s prestigious M-Prize for innovation in 2013, and we have supported more than 550 enterprises across 51 programs in 9 countries. Since 2009, Village Capital has supported more than 1,000 entrepreneurs through our programs and partnered with affiliated investment funds, including VilCap Investments, that have invested seed capital in more than 90 program graduates. Over the past 8 years, our program graduates have gone on to generate $61.5M in revenue, reach 8.5 million customers, and create over 11,500 jobs. 96% of our alumni would recommend our program to other entrepreneurs, and to date and 91% of our entrepreneurs are still in business."
Fiveable,"EdTech, Education, Secondary Education","1,074","Fiveable is a social network platform for education that offers students learning through content, community, and courses. Fiveable is on a mission to create educational equity through social learning. The student-centered platform includes a robust content library, engaging community spaces on Hours, and interactive experiences that connect students who are learning the same thing at the same time."
Coderhouse,"EdTech, Education","1,092","Coderhouse offers live online courses in programming, design, data, and marketing for professionals. Students must turn in assignments that are corrected by their mentors for each class, and at the end of the course, they must turn in and approve a final project. They also assist the chosen students with career services such as mock interviews. Coderhouse was founded in 2019 and is headquartered in Buenos Aires, Argentina."
Ad Fontes Media,"EdTech, Journalism, Media and Entertainment, News, Social Entrepreneurship","1,400","Ad Fontes Media is a public benefit corporation that rates the news. The company helps businesses, consumers, educators, and platforms navigate the complex and dynamic news landscape and also provides data, tools, and educational resources for all stakeholders in quality news media."
Udemy,"E-Learning, EdTech, Education, Training","1,434","Udemy's mission is to create new possibilities for people and organizations everywhere by connecting them to the knowledge and skills they need to succeed in a changing world. The Udemy marketplace platform, with thousands of up-to-date courses in dozens of languages, provides the tools learners, instructors, and enterprises need to achieve their goals and reach their full potential. Millions of people learn on Udemy from real-world experts in topics ranging from programming and data science to leadership and team building. For companies, Udemy Business offers an employee training and development platform with subscription access to thousands of courses, learning analytics, and the ability to host and distribute their own content."
Caribu,"EdTech, Education, Software","1,564","Caribu is a family video calling and reading platform that provides an engaging long-distance communication experience for kids. It integrates children’s picture books into a simple, child-friendly video calling app. It also brings together interactivity and education to create a communication tool for the modern family. Caribu was founded in 2016 and is headquartered in Miami, Florida."
BabySparks,"E-Learning, EdTech, Education, Software","1,589","BabySparks is a developer of tools and programs to help parents engage their babies and toddlers in the critical areas of early development. The company's early development program learns each child's unique profile, identifies specific needs, and provides meaningful activities to support them. The company was established in 2013 and is headquartered in Plantation, Florida."
University of Virginia,"E-Learning, EdTech, Education","1,593","University of Virginia is an educational institution that offers undergraduate, graduate, postgraduate, and professional degree programs in the fields of architecture, arts, sciences, law, medicine, and nursing. The schools of the university include School of Architecture, College of Arts and Sciences, Graduate School of Arts and Sciences, School of Law, School of Medicine, McIntire School of Commerce, Darden Graduate School of Business Administration, and School of Nursing. The university offers 51 bachelor's degrees in 47 fields, 84 master's degrees in 67 fields, 6 educational specialist degrees, two first-professional degrees (law and medicine), and 57 doctoral degrees in 55 fields. Affiliated with 7 Nobel laureates, it has produced 5 NASA astronauts, 7 Marshall scholars, 4 Churchill scholars, 29 Truman scholars, and 50 Rhodes scholars. Thomas Jefferson founded the University of Virginia in 1819. He wished the publicly-supported school to have a national character and stature. It is the first non-sectarian university in the United States and the first to use the elective course system. Jefferson considered the founding of the university to be one of his greatest achievements. Undertaking the project toward the end of his life after a long and illustrious career that included serving as a colonial revolutionary, political leader, writer, architect, inventor, and horticulturalist, he was closely involved in the university's design. He planned the curriculum, recruited the first faculty, and designed the Academical Village, a terraced green space surrounded by residential and academic buildings, gardens, and the majestic center-point, the Rotunda. The most recognizable symbol of the university, the Rotunda stands at the north end of the Lawn and is half the height and width of the Pantheon in Rome which was the primary inspiration for the building. The Lawn and the Rotunda have served as models for similar designs of centralized green areas at universities across the United States. The university was opened for classes in 1825 with a faculty of eight and a student body numbering sixty-eight. Jefferson took great pains to recruit the most highly qualified faculty, five of whom were found in England and three in the United States. Instructions were offered in ancient languages, modern languages, mathematics, moral philosophy, natural philosophy, chemistry, law, and medicine. Jefferson opposed the granting of degrees on the grounds that they were ‘artificial embellishments’. In 1824, however, the Board of Visitors authorized granting the Master of Arts degree. The Doctor of Medicine or M.D. was awarded to the first graduates of the School of Medicine in 1828 and the Bachelor of Law degree or LL.B. was first awarded for law school graduates in 1842. The bachelor's degree was awarded beginning in 1849, but became the standard undergraduate degree and a prerequisite for the master's degree in 1899 bringing the university into conformity with other institutions of higher learning. The PhD has been awarded since 1883."
Caltech,"EdTech, Education, Universities","1,663","The California Institute of Technology (Caltech) is a world-renowned science and engineering research and education institution, where extraordinary faculty and students seek answers to complex questions, discover new knowledge, lead innovation, and transform our future. The mission of the California Institute of Technology is to expand human knowledge and benefit society through research integrated with education. We investigate the most challenging, fundamental problems in science and technology in a singularly collegial, interdisciplinary atmosphere, while educating outstanding students to become creative members of society. Caltech was founded as Throop University in 1891 and renamed the California Institute of Technology in 1920. Its 124-acre campus is located in Pasadena, California."
Physics Wallah,"E-Learning, EdTech, Education, Tutoring","1,670","PhysicsWallah aims at providing quality content to every child for free. Live classes, video lectures, test series, lecture notes, topic-wise assignments with best questions, dynamic exercises, and much more. Almost 90% content on this App is free and will always be."
Upswing,"EdTech, Higher Education, Software","1,849","Upswing provides colleges and universities with an integrated student services platform to increase student retention. Colleges are able to integrate their various student support operations in a virtual environment to allow students to easily find and meet with staff in support functions like advising, counseling, student success coaching, and tutoring. Additionally, Upswing's virtual assistant connects students via SMS to college reminders and information. By streamlining student services, college administrators are able to manage support staff in a single location, oversee communication with students, and access streamlined reporting and insights."
Simplilearn,"Corporate Training, E-Learning, EdTech, Education, Training","1,906","Simplilearn helps professionals across the globe realize their dream careers. As a destination for certification training courses, the company caters to professionals across industries and functions. Through a combination of proven training content, blended delivery model and next-gen customer experience, Simplilearn offers courses that help professionals get the edge they want in their careers.  With study centers across the globe, Simplilearn offers 200+ certification courses in Project Management, IT Service Management, Microsoft Certification, Quality Management, Financial Management and more. Rated by Deloitte as the 4th fastest growing technology firm in India and 11th in Asia, and by the IAMAI as the best educational website, the company has trained over 400,000+ professionals across 150+ countries. Simplilearn is the Global Registered Education Provider (REP) of PMI, USA, Accredited Training Organization (ATO) by APMG International, UK, Registered Education Provider (REP) of Scrum Alliance Inc., and Accredited Examination Center (AEC) by EXIN, TUV-SUD, EC Council and PEOPLECERT.  In September 2013, Simplilearn raised $10-million in Series B funding from Helion Venture Partners and Kalaari Capital to diversify and expand its course catalog. Simplilearn’s mission is to consistently provide best-in-class training to working professionals through proven content, robust technology and a focus to achieve 100% customer delight.  For more information, visit www.simplilearn.com"
LingoAce,"E-Learning, EdTech, Education, Language Learning","1,979","LingoAce is an online education platform committed to providing a fun and engaging learning environment for young learners between 3-15 years old. Headquartered in Singapore, LingoAce is currently the leading Mandarin Chinese language learning platform globally, serving learners across 100 countries and regions. LingoAce harnesses the capabilities of research-backed digital content, certified teachers, animation, gamification, and AI to effectively deliver authentic and interactive online language lessons. In addition to online live Chinese language lessons, LingoAce has expanded to offer online live English programs, and app-based early years learning programs. In 2022, LingoAce was recognized by GSV as one of the top 150  most transformational growth companies in digital learning."
University of Maryland,"EdTech, Education, Universities","2,095","University of Maryland has enjoyed a remarkable rise in accomplishment and reputation over the past two decades after using uptodate exam dumps by certkillers.net. By any measure, Maryland is now one of the nation's preeminent public research universities and on a path to become one of the world's best by simply adopting latest certification techniques by certkillers.net. To fulfill this promise, we must capitalize on our momentum, fully exploit our competitive advantages, and pursue ambitious goals with great discipline and entrepreneurial spirit. This promise is within reach."
