Organization Name,Industries,CB Rank (Organization),Full Description
K16 Solutions,"EdTech, Higher Education, Software","39,021","K16 Solutions provides a content migration software to develop programs involved in higher education. It also offers the ability to move content off old platforms in a fast and accurate way and also helps to design, maintain, and upload courses on learning management systems, and archive courses via a user-friendly, guided process. Additionally, it helps businesses reshape how students, staff, and faculty collaborate."
Academy Xi,"EdTech, Education, Information Technology, Online Portals","39,150","Academy Xi is a future focused training company that provides short, practical and skill specific programs for individuals and teams to upgrade their capabilities in design and emerging technology.  Our product mix is focused on emerging fields in Design and Tech and, in our classes, we aim to help individuals transform their careers.  Our team training programs continue to attract large, progressive organisations who are looking to scale their design and tech capabilities. Using a structured, modular approach we customise our core programs to fit the unique needs of every company we engage with. We’re problem solvers and strive to embed purpose into what we do. Our vision is to truly transform the world through education and the community we’re building."
Firefly Learning,"CRM, E-Learning, EdTech, Education, SaaS, Software","39,298","They are a fast growing business with a rapidly developing product. They are passionate about growing in a way that benefits their existing clients. Every year, they re-invest significantly in their team. The Firefly team is made up of a mixture of expert technologists, teachers, designers, support specialists and account managers. It's that mixture they think helps us to understand their schools better. They enjoy writing and supporting software that teachers, students and parents enjoy using. By focusing on education, they can make sure that Firefly has just the features you need and not the ones you don't. A lot of their best ideas they get from the teachers, students and parents they stay in close contact with as they continue to develop the product! They think it's important to work with trusted partners in the industry so they don't spend their time re-inventing the wheel, and you can choose best of breed products and services that work well together. Although wthey have got schools using Firefly across the world, they are proudly based in London and also have offices in Brighton."
Abre.io,"EdTech, Education, Software","39,299",Abre.io develops an administration platform providing modern data solutions for K-12. It removes silos and ensures all stakeholders know how to turn analysis into action with impactful decision-making to support the whole child.
Develhope,"EdTech, Information Services, Information Technology","39,310","Develhope is the creator of a coding platform for job interview preparation. The platform of the organization comprises video lessons, concept notes, and study material, allowing students and job seekers to effortlessly study, practice, and absorb topics at their own pace."
Principia,"EdTech, Financial Services, FinTech, Information Technology, Software","39,346","Principia develops and operates a digital platform that manages financial processes of universities. It is based in Sao Paulo, Brazil."
BridgeU,"Big Data, E-Learning, EdTech, Education, Enterprise Software","39,346","At BridgeU, we believe that talent is equally distributed across the globe, but opportunity is not. We believe guidance is necessary for every stage of learner, and we believe in education as a key driver of human potential. BridgeU is the leading provider of university & careers guidance software & services to international, global and world secondary schools. Today, BridgeU works with secondary schools in 120 countries supporting students over a 24-36 month journey to explore and research career pathways and post-secondary opportunities, before preparing and submitting applications to universities around the world. School advisors use BridgeU to power their university and careers guidance provision and to support students’ post-secondary planning efforts. We also help universities to discover and engage the schools and students that will contribute to their vibrant, diverse and successful programs and courses. In 2021, we believe BridgeU has never been more important to help students, schools and universities discover new opportunities globally and connect at a distance."
ApprenNet,"EdTech, Information Technology, Mobile, Software, Web Development","39,431","ApprenNet provides web and mobile platform to enable practice-based learning for both soft skills and hands-on technical training. The company provides a platform to deliver apprenticeship-style learning. Employers and educators use the platform to enhance critical thinking, communication, and hands-on skills across their organizations. Its patent-pending technology for individual practice, peer review, expert coaching, and performance analytics was developed through research funded by the National Science Foundation."
DTP Education Solutions,"E-Learning, EdTech, Education","39,433",DTP Education Solutions provides education solutions in Vietnam.
OneGoal,"EdTech, Education, Higher Education, Non Profit","39,705","OneGoal offers that solution at a low cost and makes graduation a reality for all students. OneGoal collaborate closely with public schools in low-income communities, providing teachers with a robust curriculum, technology, training and coaching to implement our three-year model with a group of 25 students (Fellows) per cohort. Teachers support the same group of Fellows beginning in their junior year of high school and bridge the gap through their first year of their postsecondary education."
Davidson College,"EdTech, Education, Higher Education","39,792","Davidson College, in Davidson, North Carolina, is an academically rigorous liberal arts school with an impressive list of alumni. Davidson College also boasts an excellent financial aid program. Davidson awards academic and professional bachelor’s degrees. Some available include:   * Art   * Classics   * Environmental Studies   * Education   * Pre-Medicine   * Pre-Law   * Religion   * Theatre Davidson also offers such unique majors as:   * Medical Humanities   * South Asian Studies All of Davidson’s academics are of a high caliber. Consequently, over 20 Davidson graduates have received the prestigious Rhodes Scholar award. The Davidson experience also emphasizes civic engagement. Many students, therefore, undertake community service assignments. Davidson’s financial aid program ensures that all students graduate free of debt. They do this by offering grants and scholarships in place of student loans. Financial aid eligibility requirements include financial need and, in some cases, academic performance. Applications for admission should include transcripts, two academic recommendations, a peer recommendation and a personal essay. Neither ACT nor SAT scores are required, though they are highly recommended."
Merge EDU,"Augmented Reality, EdTech, Education, Virtual Reality, Wearables","39,813","Merge develops the award-winning Merge Cube, Headset, Miniverse and EDU Platform. Our product ecosystem is an all-in-one, curriculum-aligned AR/VR solution for classrooms, libraries, STEM labs and makerspaces.  By merging the physical and digital, the learning tools we’ve created are unlike anything you’ve ever seen or touched. They evoke a sense of wonder and amazement, and accelerate understanding, deepen engagement, and let you do the impossible."
Bites,"Apps, Assistive Technology, Content, EdTech, Human Resources, Knowledge Management, Mobile Apps, Retail Technology, Software","39,821","Bites is a computer software company that offers a mobile application platform that allows its users to manage digital bitesize learning units. The Bites platform includes a content creation app that lets organizations create professional looking content they call Bites.  Each Bite can be shared with employees using the communication platforms they already use including WhatsApp, MS Teams, Slack, Signal, WeChat, Telegram and many more… The company was founded in 2017 and headquartered in Tel Aviv, Israel."
Kaochong,"EdTech, Education, Internet","39,894","Kaochong is an online education platform that offers English test preparation classes for the College English Test (CET), IELTS, TOEFL, and other."
Pharm Znanie,"EdTech, Education, Pharmaceutical","39,922","Pharm Znanie is an online learning center that increases profitability of pharmacies and pharmaceutical companies. It organizes and conduct trainings via the Internet: seminars, trainings, conferences, discussions and courses for pharmacists, pharmacists, purchasing managers, heads and managers of pharmacies, marketers and PR managers of pharmacy chains, medical representatives, pharmaceutical companies, distributors."
Aprende Institute,"EdTech, Education","40,072",Aprende Institute is the online education platform for vocational skills training in the US hispanic market and LATAM.
manebi Japan,"EdTech, Education, Video Editing","40,078",manebi is an Career development support platform business to support human transformation.
Growth Tribe,"Corporate Training, Data Mining, EdTech, Education, Training","40,231","Growth Tribe is a digital learning partner for both individuals & organisations, specialising in Growth, Digital Marketing, Data, UX Design & Digital Leadership. We help our learners and partners acquire the most in-demand digital capabilities through actionable, hands-on and enjoyable courses & learning programs. Growth Tribe has supported the learning journeys of over 25,000 adults in over 900 organisations and that’s only the beginning. We are on a mission to elevate humanity through learning by transforming how professionals and businesses learn and grow."
Frank Financial Aid,"EdTech, Education, Finance, Financial Services","40,383",Frank’s online platform streamlines and simplifies the Free Application for Federal Student Aid (FAFSA®) application process. Its mission is to help students reach their greatest potential by getting the most value from their education. Frank aims to assist each student and help them get their maximum financial aid.
ChalkTalk,"E-Learning, EdTech, Education","40,450","ChalkTalk is a platform for teachers and trainers to build, personalize, and run their real-time learning courses. Using results from a student placement test, ChalkTalk’s machine-learning software generates a standards-aligned curriculum customized to fit within the existing class schedule. Lesson plans, instructional materials, and small group activities are adaptively generated for the teacher, while personalized practice problems and review exercises are adaptively generated for each student. In this way, ChalkTalk acts as the ultimate teacher’s assistant - scaffolding instruction for each student while using class progress to shape future instruction. After just 15 weeks, every school that used ChalkTalk had their students experience 2-6x more growth on state test scores compared to their peers after a full year of traditional instruction."
Fact Japan,"EdTech, Education","40,564","Fact Japan develops a human resource service business specializing in the service industry from small and medium-sized enterprises to large companies. They offer temporary staffing, recruitment, and outsourcing services."
Dreamscape Learn,"Digital Entertainment, EdTech, Software, Virtual Reality","40,902","Dreamscape Learn is an edtech company focusing on cinematic story-telling, cutting-edge immersive technologies, and advanced pedagogy. They believe that the best educational designs combine multiple pedagogical modalities. Students study; they apply knowledge and concepts; they learn by doing and do in order to learn; they learn through text, lecture, visual and audio media, hands-on experience, and from one another. They create programs and products that connect all of these modes of engagement."
Renaissance Learning,"Big Data, E-Learning, EdTech, Education, Software","40,917","Renaissance Learning provides computer-based assessment technology and school improvement programs for pre-kindergarten through senior high schools and districts in the United States and internationally alongside its subsidiaries. Its educational software products cover various subject areas such as reading, early literacy, mathematics, writing, vocabulary, and language acquisition."
Smashcut,"E-Learning, EdTech, Education, Film, Film Production, Media and Entertainment, Video","40,961","Smashcut is an education technology and content company that has built a next-generation learning platform designed for video-centric, collaborative education. Smashcut partners with education brands to develop and deliver customized online programs. The company was founded in 2016 by Daniel Blackman, co-founder of Howcast and a former executive at Google, YouTube, and Barnes & Noble.com."
Amlab,"EdTech, Education","41,021",Amlab is an education platform that offers online courses for people of creative specialties.
Rocket Skills,"E-Learning, EdTech, Small and Medium Businesses","41,135","Rocket Skills is the Edu-tech platform that seeks to make up-skilling through high quality online mentorship and structured online courses an incredibly accessible and affordable experience for anyone who aspires to start a business with a small investment. Our quest to deliver “high-quality, no-frills learning” to anybody with an internet connection is corroborated by the carefully curated list of experts who design and deliver courses with a precise, step-by-step learning approach and live video sessions for one-on-one Q&A and periodic discussions. We place special emphasis on creating a tight-knit community of entrepreneurs who’d come together in collaboration, knowledge sharing and result in a a multitude of synergies, making the Indian MSME sector the gold standard in MSME industries across the globe. While we have begun with the Agriculture-Education sector, we have not limited ourselves to this space and are building something a wider audience can resonate with."
Coorpacademy,"Corporate Training, EdTech, MOOC","41,186","Coorpacademy offers a range of innovative learning solutions and MOOCs. It was founded by Frederick Benichou, Jean-Marc Tassetto, and Arnauld Mitre in 2013 and is based in Lausanne, Switzerland."
Albert School,"EdTech, Education","41,227","Albert School offers a hybrid post-baccalaureate business and data program .They provides educational approach through practice with concrete cases. They builds business and data education. The  provides delivers certifications and also ECTS credits and training. They are specialized data professions such as data analysts, data scientists, data strategists."
Narbis,"Consumer Goods, EdTech, Fitness, Health Care, Training, Wearables, Wellness","41,278","Narbis produces multiple wearable technologies that improve mental wellness.  Narbis Smartglasses help users train their brains to better focus and concentrate.  Targeted at the growing population of people suffering from ADHD, Narbis Smartglasses utilize neurofeedback to provide a drug-free method to improve focus while completing everyday tasks like homework or reading.  Narbis illume uses colored light, sound, and tactile transducers that combine to facilitate Audio Visual Entrainment (AVE), which in turn leads to better relaxation, reduced anxiety, improved focus, and enhanced meditation.  Both products are sold direct-to-consumers at www.narbis.com."
Seneca College,"EdTech, Education, Higher Education, Universities","41,396","Seneca College of Applied Arts and Technology is a public college located in Toronto, Ontario, Canada. It offers full-time and part-time programs at the baccalaureate, diploma, certificate and graduate levels. Seneca offers more than 145 full-time programs and 135 part-time programs including 14 Bachelor's degrees and 30 graduate certificates.[2] Many programs offer experiential learning opportunities such as co-op, placements, internships and community service options, while others include a mandatory co-op period prior to graduation. Seneca also offers career search assistance to graduating students. Seneca College programs are developed and kept current with the assistance of advisory committees made up of key industry members. They are in place to ensure the education students receive provides the skills necessary for career success. Seneca College is the leader in Ontario in university and college pathways. It has more than 70 transfer agreements with both local and international post-secondary institutions, including universities in Australia, England, South Africa and the U.S. These agreements allow students to apply their college education to obtain credit towards a university degree."
Prepseed,"Consulting, EdTech, Information Services","41,527","Prepseed is an AI-powered learning solution platform for exam preparation for JEE, NEET, and other examinations."
boclips,"E-Learning, EdTech, Education, Podcast, Video","41,690","boclips aggregates over 2 million rights ready video clips onto a single cloud based platform. Proprietary algorithms then map these clips to the curricula and courses used by education providers around the world - ensuring relevant search results for courseware designers, instructors and students. All videos are rights-ready for education and updated daily - so there’s no confusion and no delays."
Boulo Solutions,"Career Planning, EdTech, Employment, Human Resources","41,882","The lack of career progression, professional support, and flexibility in mothers' jobs makes staying in the workforce difficult. Once mothers leave, they struggle to get back in. Boulo keeps women in the workforce by surfacing flexible jobs and offering customized, progressive professional training and support through our online platform."
Little Leap,"EdTech, Mobile","41,897","Little Leap is an ed-tech startup that provides an online holistic development platform for children, assisting them in developing essential soft skills, life skills, leadership skills, and creativity. Little Leap integrates concepts and learnings into super fun gamified group sessions that children adore. Little Leap fosters the development of the next generation's confident communicators, critical thinkers, and problem solvers."
KUBO Robot,"Children, E-Learning, EdTech, Education, Edutainment, Electronics, Information Services, Robotics, Software, STEM Education","42,037","KUBO empowers kids to explore robotics, programming, problem-solving and creative thinking through tangible play. We do this in a play and plug manner without no need of prior knowledge of programming and no requirements of a tablet or computer."
Acrobatiq,"Analytics, EdTech, Education, Software","42,039","Acrobatiq, backed by Carnegie Mellon is scaling the pioneering research in online learning from CMU's Open Learning Initiative (OLI) and enabling educational institutions to improve learning outcomes at reduced costs through data-driven, personalized learning solutions. Our learning-science based approach to course design, and breakthrough analysis and modeling of learning data enables adaptive instruction for students, and gives faculty visibility into who is learning, who’s not, and where help is needed. Together, this convergence of learning science, technology, and data is empowering more students to succeed at a time when post-secondary credentials are more in demand than ever."
Girls Who Code,"E-Learning, EdTech, Education","42,071","Together with leading educators, engineers, and entrepreneurs, Girls Who Code has developed a new model for computer science education, pairing intensive instruction in robotics, web design, and mobile development with high-touch mentorship and exposure led by the industryâ€™s top female engineers and entrepreneurs. In its inaugural program, Girls Who Code empowered young women from New York Cityâ€™s five boroughs and will launch programs in New York, Detroit, San Francisco, and San Jose in 2013."
Knowbox,"Apps, Children, EdTech, Education, Mobile","42,424","Established in 2014, Knowbox targets the K12 education field with two mobile apps currently helping students get the most from doing homework by providing personalized exercises. Teachers can use the mobile apps to better manage student homework by avoiding repetitive labor and securing more time to help each student's unique challenges. The company claims the two mobile apps currently have nearly one million daily active users, and plans to use the proceeds on building its own homework database."
Skill and You,"E-Learning, EdTech, Education, Training, Vocational Education","42,541","Skill and You is the leading provider of vocational e-learning in France with its commitments to innovation and professionalism. Employment is a major issue today, and Skill and You is positioned to deliver to learners real results and qualifications (BAC PRO, BEP, BP, BTS, CAP) via our effective pedagogy and adaptable education technology. Leveraging our group’s experiences and deep knowledge, we’ve built a strong track record of successful schools across sectors, empowering learners to change their lives."
OpenGenus,"EdTech, Education, Internet, Software","42,547",OpenGenus' focus is to help everyone get on track with understanding computer science concepts and bring back the computing future. Their online internship program is designed to help everyone get started with programming and computing research at scale.
Nas Company (Formerly Nas Academy),"Communities, Content Creators, Digital Media, E-Learning, EdTech, Education, Social Media, Video","42,660","Nas means people – and we, as Nas Company, are on a mission to build community products that bring people together! From the early days of Nas Daily, our mission has been to form communities around the world. We believe that people learn better in communities. People can do more together. People can find mentors, coaches, thought leaders, and friends in communities. A strong community is worth a thousand marketing campaigns. Nas.io is building products for Community Builders, Brands, Content Creators, DAO builders, and anyone who also wants to bring people together. We have built tools and integrations that will let you start and manage an engaged community.  As a company, we’ve successfully built communities over and over again – and now, we are building tools and integrations that will allow other people to build communities faster than ever before."
Maven,"E-Learning, EdTech, Education","42,669",Maven is a developer of an online cohort-based leadership program designed to create a community where anyone can start their own course.
Gradescope,"EdTech, Higher Education, Skill Assessment, Software","42,826","Gradescope enables instructors to grade paper-based assignments online in half the time, for free. Their product has already been used to grade over 3 million pages of work belonging to over 30,000 students at over 100 schools. The company's mission is to enable data-driven education for teachers and students while being backwards compatible with paper. Founded in 2014, the company is headquartered in Berkeley, California, United States."
Baetho India,"Digital Signage, EdTech, SaaS, Sales Automation, Software","42,916","We started this company back in July of 2014 with the belief that customer experiences would change forever and that interactive and experiential experiences were the way forward.  We are a solutions focused company with the vision of democratizing the development of interactive applications through our proprietary no code platform, Baetho. We can turn designs into rich digital experiences in just a few clicks. This is achieved through drag and drop without any code by utilizing built-in templates with easy customization through workflows and layouts. Every experience we build is unique and customised to the needs of our clients.  We are digital storytellers and are experts in digital transformation. We have provided custom solutions such as Interactive Kiosks, Meeting Room Solutions, Consultative Sales Tablets, Phygital Models, Touch Screen Tables and more to large clients across various verticals. Some of our clients include: Prestige Group, Karle Infra, Bhartiya City, Salarpuria Sattava, Noor Energy, Hp, Volvo, Wipro, Bren etc. During this journey, our team grew organically and we reached a point wherein the services portion of our business is a self-sustaining unit. Along the way, we were able to update Baetho and with each new project we continue to enhance it’s capabilities.  Our vision has always been to license Baetho out to other companies who can use it to build amazing interactive experiences for their clients and this continues to be our primary focus going forward."
MotivApp,EdTech,"42,920","MotivApp is a mobile application to motivate students to study. Its use provides advantages such as enhancing student motivation, decreasing school stress, and balancing learning intensity. They created a motivational strategy based on a creative reward system that can be integrated into the categorization system and used in distance learning."
