Organization Name,Industries,CB Rank (Organization),Full Description
Sense Education,"Artificial Intelligence, EdTech, Education, Personalization","59,026","The future of education lies in preserving the learning dynamic of a small class, while accommodating massively more students. Sense lets educators virtually review and analyze every student's work, regardless of how many students there are. Courses improve. Outcomes improve. Everyone wins."
sofatutor,"EdTech, Education, Online Portals","59,089","Sofatutor is an online platform that of educational tutorials for school and college students to study for exams and recapitulate lessons. It offers short video tutorials, exercises, homework chat, and tutoring sessions for subjects such as mathematics, physics, English, French, Latin, computer science, economics, medicine and health, law, humanities, and so on. Sofatutor was launched by Stephan Bayer in February 2008 and is based in Berlin, Germany."
Fluent City,"Artificial Intelligence, Continuing Education, EdTech, Education, Internet, Language Learning, Natural Language Processing","59,134","Fluent City is a language company that offers online classes in 11 different languages. We're on a mission to help you achieve your language-learning goals by teaching you how to talk about the things you care about most. Our team uses AI and natural language processing technology to provide hyper-relevant content and personalized, engaging lesson plans that help you get fluent faster."
Winc Academy,"E-Learning, EdTech, Education, Higher Education, STEM Education, Training","59,163","Winc Academy is an international education platform that offers high quality courses with personal guidance. Learners acquire future skills and boost their careers in coding, tech, and data. Winc Academy increases accessibility to quality education through asynchronous online education with scalable personal mentoring. B2C, B2B and B2G."
Zenith Learning Group,"EdTech, Education, Tutoring","59,203","Zenith Learning Group's mission is to make a world-class education affordable and accessible to all Southeast Asian students. All students, regardless of socioeconomic circumstance, should have an equal opportunity to succeed."
Explico,"E-Learning, EdTech, Education, Machine Learning","59,219","Explico is an online assessment-based learning platform using AI and machine learning that helps students to measure their learning outcomes and identify their strengths and weaknesses. Explico is currently focused on both B2C and B2B  in the K10 space, where more in-depth analytics and early warning systems can help all the key stakeholders to structure the learning based on the need and requirement."
Qingshi Quality Education Technology,"EdTech, Education","59,246","Qingshi Quality Education Technology is a quality education course service provider for primary and secondary schools. Hangzhou Qingshi Quality Education Technology offers full-service course development, teaching material publication and distribution, teacher training, and teaching and research support, with the goal of creating a colorful, interesting, and fun after-school service course system. The company provides rich courses to children, assists schools in developing after-school services, promotes the popularization and sharing of high-quality course resources and promotes the development of high-quality education."
Riyaz,"E-Learning, EdTech, Education, Music, Music Education","59,276","Riyaz is a music-tech powered pocket music guru which helps people sing better. In a gamified environment, it gives instant visual feedback showing the nature of mistakes made and guides you to improving faster."
Professor Bob.ai,"Artificial Intelligence, E-Learning, EdTech, Education, Software, Training","59,281","Professor Bob.ai offers an artificial intelligence programme that is capable of teaching, asking, and answering questions, thereby helping students with this technology."
Real Time Cases,"E-Learning, EdTech, Education","59,399","The goal of Real Time Cases is to change the landscape of higher education for professors and students through experiential learning. The company believes that contemporary education neglects to adequately prepare students for the professional work environment. Education should reward creativity while being fun, relevant, practical, interactive, and up-to-date. They foster these values by equipping students with the tools they need to approach and resolve issues for real and established companies.  Real Time Cases allows students to gain experience through helping real companies assess opportunities and resolve issues in the marketplace. For the first time ever, students and professors have exclusive access to information directly from the CEOs of startup, high-growth, and mature companies from around the globe. Bridging the gap between the intellectual classroom and the dynamic professional work environment, we allow students to incorporate their own personal experiences, critical thinking skills, unique creative potential, and research capabilities into assignments from top-level management."
Intercultural Development Research Association,"EdTech, Education, Higher Education","59,495","The Intercultural Development Research Association is an independent, private non-profit organization dedicated to strengthening public schools to work for all children.They are committed to the IDRA valuing philosophy, respecting the knowledge and skills of the individuals they work with and build on the strengths of the students and parents in their schools."
Curious.com,"EdTech, Education, Knowledge Management","59,532","At Curious they believe in lifelong learning. Learning for its own sake. Learning that happens beyond classrooms, and not only in academic subjects (unless you count beer brewing, pipe soldering, and organic gardening as academic). Learning as a necessity of living. At Curious they also believe great teachers are as valuable to society as great business leaders or academic thinkers. They wonder why there are hundreds of high-tech ways to share silly photos, and military-grade technology can help them find their friends at a bar, but teachers have few quality tools to help them succeed online. They believe teachers are some of society’s greatest entrepreneurs and should be treated as such. They also believe that videos of cats dancing the Macarena, and super-slo-mo exploding watermelons are really cool, but not the kind of online learning they’re talking about. And that Justin’s new band only reminds them a little bit of this. But that’s another story... Mostly, they believe in being curious."
Lessonbee,"E-Learning, EdTech, Education, Health Care","59,598","Developer of an online learning platform for students in grades K-12 with supplemental digital health education curriculum. Lessonbee provides culturally relevant educational content that is designed to increase health knowledge and skills and inspire healthy living. The company's platform measures student health goals and school climate via its proprietary HealthIQ analytics to recommend content from its ever-growing Content Library of self-paced classes, adaptive courses, and video-based lessons aligned to state and national health education standards, enabling personalized health education and social emotional learning for kids and teens at home and in school in classes across the curriculum."
61time.com,"EdTech, Education, Primary Education","59,699",
Slate Science (Matific),"Apps, EdTech, Education, Gaming, Mobile Apps, STEM Education","59,718","Slate Science is transforming mobile devices into interactive, adaptive learning platforms for K12 STEM education. The Slate Science platform enables rapid, multi-platform development of modular learning units, designed to offer performance-based, student-specific learning experiences."
Egg,"Artificial Intelligence, E-Learning, EdTech, Education, Internet","59,914",Egg is an education company that is driven by its mission to enhance human cooperation. Based on science and artificial intelligence. Women founded .
Cognii,"Artificial Intelligence, EdTech, Education, Machine Learning, MOOC, Software","60,051","At Cognii, we're developing leading edge assessment technology to evaluate essay-type answers for online learning platforms. Our exclusive natural language processing technology can also give customized feedback, not just a score, to engage students in an active learning process and improving their knowledge retention. We're offering Cognii's solution through an API for all online learning platforms, including LMS (Learning Management System), MOOCs (Massive Online Open Course), and more."
Fluentify,"E-Learning, EdTech, Education, Internet, Language Learning","60,058","Fluentify connects language learners with carefully selected native speakers around the world trough 30-minutes individual live sessions. Browse Tutors, book a slot with the one you like the most and become fluent talking about interesting topics."
Global Alumni Education,"E-Learning, EdTech, Education, Training","60,168","Global Alumni brings first-class continuing education from the best universities to ambitious professionals all around the world. They help universities develop and implement transformational e-learning strategies. They help professors create and refine online and blended courses in Spanish and English. They use state of the art technology to create beautiful, engaging course modules. They recruit and support professionals who learn from them. And they do it all with a positive attitude, a collaborative spirit, and a commitment to excellence."
Turing Certs,"Blockchain, E-Signature, EdTech, Finance, Real Estate, Software, Sustainability","60,174","Turing Certs, a global identity passport on blockchain, founded by Berkeley alum Yao-Chieh Hu, invested by Morgan Stanley CEO Taiwan. Mr. Ko, and coached by Google ex-CEO Taiwan, Dr. Chien. We help authorities certify credentials and identities for counterfeiting and sustainability. Now having WHO, Roche, LINE, Berkeley Law, Harvard HCAP and 120+ governments and institutes adopting us to talent certificates; and having Dun & Bradstreet and CRIF adopting us to ESG certificates."
Cloud Academy,"Corporate Training, EdTech, Education, Enterprise Software, Information Technology, Internet, SaaS, Trading Platform","60,256","Cloud Academy strives to be the main guide for companies worldwide to understand, implement and embrace cloud technologies for their businesses. We help enterprise companies stay up to date with their cloud skills and take advantage of cloud technologies at scale to continuously improve their efficiency. Cloud Academy helps our customers define their cloud strategy, understand what tools and vendors they need to rely on to improve their efficiency and we keep their teams’ skills always up to date. We use a combination of high quality, interactive and self-paced online training - covering your entire cloud stack and custom configurations - in combination with proprietary software to empower everyone in your organization with the right skills and information, from your sales department to your global IT team.  Our library is currently specialized on Amazon Web Services, Microsoft Azure, Google Cloud Platform, DevOps learning paths, Containers learning paths and a constantly growing set of DevOps enterprise tools."
Bruco Group,"Animation, EdTech, Education, Information Technology","60,323","Bruco uses innovative technology to create the ultimate product experience and create long-term value for users. The group currently has four core business segments, including Bruker Building Blocks, Bruker Animation, Bubble Education, and Brock Education. Bruco strives to create a whole ecological industry chain with ""building blocks +"" as the core, and at the same time applies to build blocks to various application scenarios, and lays out a complete T (Toy toy) + A (Animation animation) + G (Game game) +E (Education Education) industry vision."
ArtistWorks,"EdTech, Education, Internet, Music, Video","60,449","ArtistWorks, is a self-funded edtech company and the sole provider and innovator of online Video Exchange Learning in music. ArtistWorks provides music instruction in 30 different musical styles and instruments through their patented (June 2015) Video Exchange platform.  Online teaching faculty include multi-platinum recording artists, Grammy winners, Grammy nominees, and artists holding numerous awards from distinguished organizations around the world.   The ArtistWorks Video Exchange® platform allows players of all skills and experience,  to submit videos of themselves playing to an ArtistWorks teacher for his or her review.  The teacher then replies to the student with a personal video response of advice on how to improve.  Both student and teacher’s video are paired together and seen by the entire student community in the Video Exchange Library. With new Video Exchanges added regularly, the VE Library is always expanding and serves as a repository for deeper and relevant instruction.   Subscribing members get access to a hundreds of high-resolution video lessons recorded by each teacher, which includes multi-angle camera view selection, slow motion capability and video looping.  Although Video Exchange Learning is central to ArtistWorks, the platform includes multiple, digital tools that allow members to customize their learning experience as well as self-curate thousands of hours of content."
KIMO,"Artificial Intelligence, EdTech","60,680","Kimo is a venture focused on smart education in Amsterdam. Our team is focused on auto-generating individual learning paths through all online content - where the end goal is truly personalised learning paths. KIMO combines an intelligent back-end (e.g. automated knowledge domain graphs, jobs to skills mappings) with an engaging frontend (e.g. virtual assistant with QA models). More at www.kimo.ai."
Codingal,"EdTech, Education, STEM Education","60,720","Codingal is on a mission to provide coding education to every K-12 student. Coding helps improve logical thinking and problem-solving skills by 70% among kids at a young age, also enabling them to perform better in other subjects in school. Moreover, coding jobs are the future. They already constitute more than 60% of all jobs in science, technology, engineering, and math. While still in school, those who start young will be ahead of everyone by the time they get into college. They will be creators of the future. Learning to code at a young age will inspire more kids, including girls, to take up Computer Science as a major when entering college. Today, schools and traditional education systems are not equipped to provide the right coding education to children. Codingal is here to change that and empower every student with the tools, content, and live coding classes to start learning to code and build anything they can imagine."
Vad Vi Vet,"EdTech, Edutainment","60,949",Helping people improve their general knowledge - with minimal effort. We have 250 000 active weekly users.
DuPage Regional Office of Education,"EdTech, Education, Office Administration","61,057"," DuPage Regional Office of Education is a service organization whose responsibilities are defined by Illinois School Code, Illinois Administrative Code, Illinois State Board of Education mandates, and stakeholder needs. The essential role of the office is to provide high quality service and support to all stakeholders and collectively expend every effort to meet the special responsibility to prepare our children for the world they will face. In addition to the myriad of services provided directly to educators and schools, the office also provides services and support to community members, private schools, parents, children, business leaders, and others. Services include:"
Educatly,"EdTech, Education, Internet","61,075","Educatly is a student-recruitment platform that helps students study abroad at noted universities, and provides universities with access to a global student market. Educatly matches students with universities and provides a digital shared experience for communities to interact. Educatly creates digital solutions that allow students, schools, and recruitment partners to interact in a digital world that prioritizes student value."
Edves,"EdTech, Enterprise Resource Planning (ERP)","61,105","A digital infrastructure for K-12 Schools in Africa, automating learning and administration for over 1500 schools in 10 countries."
Alliant International University,"Continuing Education, EdTech, Education, Higher Education, Universities","61,166","Alliant International University gets its name from the merger of three legacy institutions: San Francisco Law School founded in 1909, United States International University (USIU) founded in 1927, and the California School of Professional Psychology (CSPP) founded in 1969. In 2001, USIU and CSPP merged, forming Alliant with San Francisco Law School (SFLS) joining in 2010. From 1909 through today, one constant remains: We specialize in preparing students for careers of impact through our model of academic rigor paired with hands-on training. Alliant International University prepares students for professional careers of service and leadership, and promotes the discovery and application of knowledge to improve the lives of people in diverse cultures and communities around the world."
AEFIS,"EdTech, Education, Internet, Software","61,289",AEFIS is a rapidly growing ed-tech firm delivering a SAAS platform for higher education program assessment.
CodeHS,"Developer Platform, E-Learning, EdTech, Education, Information Technology, Secondary Education, Software, STEM Education","61,305","CodeHS is a comprehensive teaching platform for helping schools teach computer science. We provide web-based curriculum, teacher tools and resources, and professional development. Schools have access to a 6th-12th grade computer science curriculum for free, and much more on pro — including lesson plans, a gradebook, progress tracking and dedicated support."
Talently,"Developer Platform, EdTech, Education, Software, Software Engineering, Training","61,308","Talently offers an intensive program that helps software developers get a better job in the technology industry, anywhere in the world. It is the accelerator of the careers of Latin American tech talent."
Mindtera,"EdTech, Education","61,413","Mindtera is a technology enabled company in education field for people to learn about multiple intelligences, such as : Emotional Intelligence, Social Intelligence, Physical Intelligence and Occupational Intelligence (personal growth) through personalized online life coaching. We are committed to enhance people's quality of life through scientifically validated curriculum. Founded in 2021 and based in Jakarta, Indonesia."
Lyfta,"Augmented Reality, Digital Media, E-Learning, EdTech, Education, Training, Virtual Reality","61,456","Lyfta is a platform where teachers can find a wealth of beautiful, engaging and immersive content to capture the hearts and minds of their students, making their jobs easier to introduce and delve into complex topics. Children love exploring Lyfta's real-life stories in interactive 360° worlds, built using 360°, VR & AR technology, high-quality film content and rich media articles. Lyfta's immersive resources are an ideal tool for teaching 21st Century skills and fostering values such as empathy and tolerance. Our platform is cross-curricular, covering topics such as literacy, social studies, citizenship, geography, philosophy, art, music, religious education and global education."
Orphicy,"EdTech, Education","61,531",Orphicy is an Ahmedabad-based Education Startup led by seasoned academicians with over a decade of experience.
AIAR EdTech,"Artificial Intelligence, Augmented Reality, Bitcoin, Blockchain, Digital Marketing, E-Learning, EdTech, Education, Sales, Training","61,624","AIAR is democratizing education for the 2.5 billion people in need worldwide. By using new technology to innovate totally new processes, instead of repairing old ones, AIAR is providing the world’s first mobile ecosystem for lifelong learning with 360° content scope. A much-needed solution to the three key challenges the industry is faced with. 1) Motivation: even with thousands of courses to choose from, none of them takes into consideration our individual preferences in learning. 2) Trust: widespread fraud in online certifications doesn’t make them credible enough, rendering a completion rate as low as 7%. 3) Cost: traditional education isn’t accessible to all, and the increasing demand for lifelong learning makes even online courses a burden. AIAR® Digital Ecosystem of Learning solves all these issues. Say hello to AI-support for personalization, secure blockchain certificates for credibility, and utility tokens for lifelong learning. And by the way, did we mention that the global learning market is worth $6 trillion? So, say also hello to the next unicorn… daring to change the world :-) "
CODE2040,"EdTech, Education, Enterprise Software, Non Profit, Personal Development","61,641","CODE2040 creates access, awareness, and opportunities for top minority engineering talent to ensure their leadership in the innovation economy. CODE2040's flagship program is their summer Fellows Program, which places high performing Black and Latino/a software engineering students in internships with top tech companies.  and provides mentorship, leadership training, and network development. The program consists of:  * an internship with a top tech company  * mentoring * a speaker series * company visits * interactive workshops * executive coaching During the summer, CODE2040 fellows get to:  * meet executives at tech powerhouses like Google and Facebook,  * sit down with partners at top venture firms Kleiner Perkins SoftTech VC and Greylock Partners,  * be mentored by early employees at YouTube and Quora, * work at leading edge startups Jawbone, Tumblr, and Etsy, * visit trendsetting companies like Square, Uber, Zynga and Twitter,  * present an original engineering project to founders, VCs and engineering directors from around the Valley, and more! The pilot class of 2012 had five Fellows and in 2013 the class rose to 18 Fellows working at Silicon Valley's best companies.   Why is CODE2040 important? Census projections show that people of color will collectively be the majority in the United States in the year 2040. Yet there is no indication that the substantial economic achievement gap is closing at the same rate. CODE2040 aims to make a direct impact on the gap by increasing the number of underrepresented minorities participating in and leading the high value, innovation economy."
Variiance,"E-Learning, EdTech, Unified Communications","61,660","Variiance is a Blitz-scaling startup that is building Unified Communication and ed-Tech Ecosystem, which integrates 5 products, with highend technologies under one umbrella of Vconnct platform, those products interconnected and interact with each other to serve hundreds of millions of users."
Adaptemy,"EdTech, Education, Software","61,757","Adaptemy is a leading provider of classroom-focused adaptive learning technology. Adaptemy has successfully delivered adaptive learning solutions for educational publishers across the globe since 2015. Their services include adaptive learning, educational technology, and digital learning."
Er Cenglou,"Content Creators, EdTech, Education","62,064","Er Cenglou is a portal where readers can access literature. It includes a variety of literary genres, including animation, video games, movies, television, and favorites for boys and girls. It also offers user-generated ratings for several genres of literature."
AngCheng Online Education,"E-Learning, EdTech, Education","62,130","Angcheng Education is a professional online education and training platform. The platform serves adults. It is positioned at the online level of fire-fighting registered engineers for training and employment. The core is the ability-based products. It adopts the middle-class teaching mode and implements live broadcast in the course of teaching. Ask questions in class to enhance classroom interaction. At the same time, the platform also provides personalized counseling for students based on big data. The course of the Angcheng education is based on the contents of three categories: technical pragmatism, comprehensive ability and case analysis, with interactive courseware, video, Drawing new knowledge learning scenarios such as drawings, games, and activities."
GVE Jinwosi,"EdTech, Education, Language Learning","62,251",
CourseStorm,"E-Learning, EdTech, Education, Information Technology, Software","62,259","CourseStorm develops an online course enrollment platform to simplify the class registration process. Its platform handles all the class registration, publishing, marketing, and credit card transactions while eliminating the hassle of recruiting students and handling registrations manually."
